<?xml version="1.0"?>
<TranslateStatus xmlns:xsi="http://www.w3.org/2001/XMLSchema-instance"
                 xsi:noNamespaceSchemaLocation="../../../../../giapi-status-translator/src/main/resources/statusservice/status-translator.xsd">
    <Status default="BAD" originalName="old" originalType="INT" translatedName="new"
            translatedType="HEALTH">
        <Maps>
            <Map>
                <from>0</from>
                <to>GOOD</to>
            </Map>
            <Map>
                <from>1</from>
                <to>WARNING</to>
            </Map>
            <Map>
                <from>2</from>
                <to>BAD</to>
            </Map>
        </Maps>
    </Status>
</TranslateStatus>