<?xml version="1.0"?>
<TranslateStatus xmlns:xsi="http://www.w3.org/2001/XMLSchema-instance"
                 xsi:noNamespaceSchemaLocation="../../../../../../../main/resources/edu/gemini/gmp/status/translator/status-translator.xsd">
    <Status default="BAD" originalName="old" originalType="INT" translatedName="new" translatedType="HEALTH">
        <Maps>
            <Map>
                <from>0</from>
                <to>GOOD</to>
            </Map>
            <Map>
                <from>1</from>
                <to>WARNING</to>
            </Map>
            <Map>
                <from>2</from>
                <to>BAD</to>
            </Map>
        </Maps>
    </Status>
    <Status originalName="oldnodefault" originalType="INT" translatedName="newnodefault" translatedType="HEALTH">
        <Maps>
            <Map>
                <from>0</from>
                <to>GOOD</to>
            </Map>
            <Map>
                <from>1</from>
                <to>WARNING</to>
            </Map>
            <Map>
                <from>2</from>
                <to>BAD</to>
            </Map>
        </Maps>
    </Status>
    <Status originalName="twice" originalType="INT" translatedName="first" translatedType="HEALTH">
        <Maps>
            <Map>
                <from>0</from>
                <to>GOOD</to>
            </Map>
            <Map>
                <from>1</from>
                <to>WARNING</to>
            </Map>
            <Map>
                <from>2</from>
                <to>BAD</to>
            </Map>
        </Maps>
    </Status>
    <Status originalName="twice" originalType="INT" translatedName="second" translatedType="HEALTH">
        <Maps>
            <Map>
                <from>0</from>
                <to>GOOD</to>
            </Map>
            <Map>
                <from>1</from>
                <to>WARNING</to>
            </Map>
            <Map>
                <from>2</from>
                <to>BAD</to>
            </Map>
        </Maps>
    </Status>
    <Status originalName="original1" originalType="INT" translatedName="target" translatedType="HEALTH">
        <Maps>
            <Map>
                <from>0</from>
                <to>GOOD</to>
            </Map>
            <Map>
                <from>1</from>
                <to>WARNING</to>
            </Map>
            <Map>
                <from>2</from>
                <to>BAD</to>
            </Map>
        </Maps>
    </Status>
    <Status originalName="original2" originalType="INT" translatedName="target" translatedType="HEALTH">
        <Maps>
            <Map>
                <from>2</from>
                <to>GOOD</to>
            </Map>
            <Map>
                <from>1</from>
                <to>WARNING</to>
            </Map>
            <Map>
                <from>0</from>
                <to>BAD</to>
            </Map>
        </Maps>
    </Status>
    <Status originalName="str" originalType="STRING" translatedName="target" translatedType="STRING" default="UNKNOWN">
        <Maps>
            <Map>
                <from>A</from>
                <to>B</to>
            </Map>
            <Map>
                <from>C</from>
                <to>D</to>
            </Map>
            <Map>
                <from>E</from>
                <to>F</to>
            </Map>
        </Maps>
    </Status>
</TranslateStatus>